{
  "schema_version": "axiom.package_resolution.v1",
  "packages": [
    {
      "package": {
        "registry": "fixture",
        "source": "registry:axiom-production",
        "namespace": "axiom",
        "name": "core"
      },
      "version": {
        "major": 1,
        "minor": 2,
        "patch": 3
      },
      "release_id": "axiom/core/1.2.3/package.axp",
      "manifest_digest": "ffffffffffffffffffffffffffffffffffffffffffffffffffffffffffffffff",
      "signer_key_ids": [
        "sha256:3333333333333333333333333333333333333333333333333333333333333333",
        "sha256:4444444444444444444444444444444444444444444444444444444444444444"
      ],
      "edition": "2026-policy-only",
      "compatibility": "axiom.compatibility.v1",
      "yanked": false
    }
  ],
  "edges": [
    {
      "from": null,
      "alias": "core",
      "to": {
        "registry": "fixture",
        "source": "registry:axiom-production",
        "namespace": "axiom",
        "name": "core"
      },
      "requirement": {
        "kind": "caret",
        "version": {
          "major": 1,
          "minor": 2,
          "patch": 0
        }
      },
      "selected": {
        "major": 1,
        "minor": 2,
        "patch": 3
      }
    }
  ],
  "path_dependencies": [
    {
      "from": null,
      "alias": "local-tools",
      "path": "tools/local",
      "version": null
    }
  ],
  "trace": [
    {
      "event": "path_preserved",
      "from": null,
      "alias": "local-tools",
      "path": "tools/local"
    },
    {
      "event": "constraint_added",
      "from": null,
      "package": {
        "registry": "fixture",
        "source": "registry:axiom-production",
        "namespace": "axiom",
        "name": "core"
      },
      "requirement": {
        "kind": "caret",
        "version": {
          "major": 1,
          "minor": 2,
          "patch": 0
        }
      }
    },
    {
      "event": "catalog_authenticated",
      "package": {
        "registry": "fixture",
        "source": "registry:axiom-production",
        "namespace": "axiom",
        "name": "core"
      },
      "authentication_id": "dddddddddddddddddddddddddddddddddddddddddddddddddddddddddddddddd",
      "candidate_count": 2
    },
    {
      "event": "candidate_considered",
      "package": {
        "registry": "fixture",
        "source": "registry:axiom-production",
        "namespace": "axiom",
        "name": "core"
      },
      "version": {
        "major": 1,
        "minor": 3,
        "patch": 0
      },
      "release_id": "axiom/core/1.3.0/package.axp"
    },
    {
      "event": "candidate_rejected",
      "package": {
        "registry": "fixture",
        "source": "registry:axiom-production",
        "namespace": "axiom",
        "name": "core"
      },
      "version": {
        "major": 1,
        "minor": 3,
        "patch": 0
      },
      "reason": {
        "reason": "yanked"
      }
    },
    {
      "event": "candidate_considered",
      "package": {
        "registry": "fixture",
        "source": "registry:axiom-production",
        "namespace": "axiom",
        "name": "core"
      },
      "version": {
        "major": 1,
        "minor": 2,
        "patch": 3
      },
      "release_id": "axiom/core/1.2.3/package.axp"
    },
    {
      "event": "candidate_verified",
      "package": {
        "registry": "fixture",
        "source": "registry:axiom-production",
        "namespace": "axiom",
        "name": "core"
      },
      "version": {
        "major": 1,
        "minor": 2,
        "patch": 3
      },
      "manifest_digest": "ffffffffffffffffffffffffffffffffffffffffffffffffffffffffffffffff"
    },
    {
      "event": "selected",
      "package": {
        "registry": "fixture",
        "source": "registry:axiom-production",
        "namespace": "axiom",
        "name": "core"
      },
      "version": {
        "major": 1,
        "minor": 2,
        "patch": 3
      }
    }
  ]
}
